category,cooking_method,cuisine,image,ingredients,prep_time,recipe_name,serves,tags
,"['Mix warm corn with toasted coconut, honey, salt. Chill briefly. Tropical-style sweet-savory corn salad.']",['Nepali'],https://images.unsplash.com/photo-1490645935967-10de6ba17061?w=800&q=80,"['2 cups boiled corn kernels', '1/2 cup coconut flakes', '1/4 cup honey', 'pinch salt']",20 minutes,Seasonal Special Snack 863,4 servings,"Vegetarian, Snack"
,"['Melt jaggery-ghee, stir in puffed millet and nuts, spread thin, cool to brittle. Break into shards—crunchy energy snack.']",['Nepali'],https://images.unsplash.com/photo-1540189549336-e6e99e49c67f?w=800&q=80,"['1 cup puffed millet', '2 tablespoons ghee', '1/4 cup jaggery', 'nuts']",30 minutes,Seasonal Special Snack 864,4 servings,"Vegetarian, Snack"
,"['Peel eggs, dip in spiced besan batter, deep-fry 3 minutes golden. Drain, serve with achar—mini scotch egg Nepali twist.']",['Nepali'],https://images.unsplash.com/photo-1476224203421-74177f9f4a76?w=800&q=80,"['12 quail eggs or small eggs (boiled)', '1/2 cup spiced flour batter', 'oil for frying']",25 minutes,Seasonal Special Snack 865,4 servings,"Vegetarian, Snack"
,"['Chop bamboo, mix into batter with chili-cumin, drop fritters, fry crisp 4 minutes. Tangy fermented pakoda.']",['Nepali'],https://images.unsplash.com/photo-1414235077428-338989a2e8c0?w=800&q=80,"['1 cup fermented bamboo tips', '1/2 cup chickpea batter', 'spices']",40 minutes,Seasonal Special Snack 866,4 servings,"Vegetarian, Snack"
,"['Toss sprouted moong with chopped veggies, lemon, masala. No-cook healthy sprout chaat.']",['Nepali'],https://images.unsplash.com/photo-1482049016688-2d3e1b311543?w=800&q=80,"['2 cups sprouted moong', 'onion-tomato salad', 'lemon-chaat masala']",20 minutes,Seasonal Special Snack 867,4 servings,"Vegetarian, Snack"
,"['Mash seeds lightly, coat batter, fry until crunchy outside. Seasonal seed fritters.']",['Nepali'],https://images.unsplash.com/photo-1473093295043-cdd812d0e601?w=800&q=80,"['200g jackfruit seeds (boiled)', 'spiced besan coating', 'oil']",30 minutes,Seasonal Special Snack 868,4 servings,"Vegetarian, Snack"
,"['Toss roasted foxnuts in warm honey-spice glaze, cool to clusters. Nutty sweet crunch.']",['Nepali'],https://images.unsplash.com/photo-1466637574441-749b8f19452f?w=800&q=80,"['1 cup roasted foxnuts', '1/4 cup honey', 'spices']",25 minutes,Seasonal Special Snack 869,4 servings,"Vegetarian, Snack"
,"['Dip bread cubes in spiced egg, shallow-fry 3 minutes, top with onion relish. Bread pakoda variation.']",['Nepali'],https://images.unsplash.com/photo-1512621776951-a57141f2eefd?w=800&q=80,"['4 bread slices (cubed)', 'egg batter', 'onion-chili mix']",35 minutes,Seasonal Special Snack 870,4 servings,"Vegetarian, Snack"
,"['Chop fruits, bind with warm jaggery-cardamom syrup, roll into balls. No-bake energy laddus.']",['Nepali'],https://images.unsplash.com/photo-1498837167922-ddd27525d352?w=800&q=80,"['2 cups mixed dried fruits', 'jaggery syrup', 'cardamom']",20 minutes,Seasonal Special Snack 871,4 servings,"Vegetarian, Snack"
,"['Mix popped amaranth with melted ghee-jaggery, press flat, cut squares. Nutritious sweet bars.']",['Nepali'],https://images.unsplash.com/photo-1567620832903-9fc6debc209f?w=800&q=80,"['1 cup amaranth (popped)', 'ghee', 'jaggery']",30 minutes,Seasonal Special Snack 872,4 servings,"Vegetarian, Snack"
,"['Grease a flat plate or tray with ghee. In a heavy-bottomed pan, melt jaggery with water on low heat. Stir continuously until jaggery dissolves. Increase heat to medium and boil until the mixture reaches hard-ball stage (120°C / 250°F on candy thermometer). To test: drop a little into cold water - it should form a hard, brittle ball. Immediately pour onto greased plate. Sprinkle sesame seeds and walnuts. Let cool for 5 minutes, then grease hands and pull/stretch the mixture slightly. Score into squares before completely hard. Once set, break into pieces. Serve during Maghe Sankranti.']",['Nepali'],https://images.unsplash.com/photo-1563379091054-1e4dddd2fbdc?w=800&q=80,"['2 cups jaggery (grated)', '1/4 cup water', '2 tablespoons ghee (for greasing)', '2 tablespoons white sesame seeds (lightly roasted)', '1 tablespoon chopped walnuts (optional)']",15 minutes (plus 2 hours setting),Chaku (Hardened Molasses - Winter Special),6 servings,"Vegetarian, Main Course"
,"['Boil water with salt in a pot. Add yam chunks. Boil for 15–20 minutes until fork-tender. Drain water. In a bowl, mix boiled yam with mustard oil, timur powder, red chili powder, turmeric, and cilantro. Toss gently. Serve warm as a winter seasonal snack, especially during Maghe Sankranti.']",['Nepali'],https://images.unsplash.com/photo-1551248429-40975aa4de74?w=800&q=80,"['500g yam (tarul, peeled and cut into chunks)', '4 cups water', '1 teaspoon salt', '2 tablespoons mustard oil', '1/2 teaspoon timur powder (Szechuan pepper)', '1/2 teaspoon red chili powder', '1/4 teaspoon turmeric powder', '2 tablespoons fresh cilantro (chopped)']",10 minutes,Tarul Ko Sidra (Boiled Yam with Spices),4 servings,"Vegetarian, Main Course"
,"['Chop gundruk finely. In a bowl, mix gundruk, gram flour, onion, green chilies, ginger-garlic paste, turmeric, chili powder, cumin powder, and salt. Add water gradually to make a thick batter. Heat oil. Drop spoonfuls of batter into hot oil. Fry until golden and crispy (3–4 minutes). Drain. Serve hot with tomato achar during rainy monsoon days.']",['Nepali'],https://images.unsplash.com/photo-1603105037880-880cd4edfb0d?w=800&q=80,"['1/2 cup gundruk (fermented leafy greens, rinsed and squeezed dry)', '1 cup gram flour (besan)', '1 small onion (finely chopped)', '2 green chilies (chopped)', '1 teaspoon ginger-garlic paste', '1/2 teaspoon turmeric powder', '1 teaspoon red chili powder', '1 teaspoon cumin powder', '1/2 teaspoon salt', 'Water as needed', 'Oil for deep frying']",15 minutes,Gundruk Pakoda (Fermented Greens Fritters - Monsoon Snack),4 servings,"Vegetarian, Snack"
,"['In a large bowl, combine puffed rice, lemon pickle, cucumber, tomato, onion, green chilies, peanuts, and cilantro. Add mustard oil and lemon juice. Toss well until everything is mixed. Serve immediately as a light summer snack.']",['Nepali'],https://images.unsplash.com/photo-1542010589005-d1eaab3cbf88?w=800&q=80,"['4 cups puffed rice (muri)', '2 tablespoons lemon pickle (nibuwa ko achar, finely chopped)', '1 small cucumber (finely chopped)', '1 small tomato (finely chopped)', '1 small onion (finely chopped)', '2 green chilies (chopped)', '2 tablespoons roasted peanuts', '2 tablespoons fresh cilantro (chopped)', '1 tablespoon mustard oil', '1 tablespoon lemon juice']",10 minutes,Nibuwa Ko Achar Bhel (Lemon Pickle Puffed Rice - Summer Cooler),3 servings,"Vegetarian, Main Course"
,"['If using fresh corn, remove kernels from cobs. Heat ghee in a large pan. Add corn kernels and roast on medium-high heat for 8–10 minutes until slightly charred and crispy. Add salt, red chili powder, black pepper, and chaat masala. Stir well for 2 minutes. Turn off heat, add lemon juice and cilantro. Serve hot as a harvest season snack.']",['Nepali'],https://images.unsplash.com/photo-1548940740-a09f9a3d09ce?w=800&q=80,"['2 cups dried yellow corn kernels (or fresh corn from 4 cobs)', '2 tablespoons ghee or butter', '1 teaspoon salt', '1 teaspoon red chili powder', '1/2 teaspoon black pepper powder', '1 teaspoon chaat masala', '2 tablespoons fresh cilantro (chopped)', '1 tablespoon lemon juice']",15 minutes,Bhuteko Makai (Roasted Spiced Corn - Harvest Season),4 servings,"Vegetarian, Main Course"
,"['Wash nettle leaves thoroughly using gloves. Chop roughly. Heat oil, add fenugreek seeds and dried chilies until seeds darken. Add ginger paste and turmeric; sauté 30 seconds. Add nettle leaves and stir for 2 minutes (nettle sting disappears upon cooking). Add water and salt. Bring to boil, then simmer for 10 minutes. Garnish with cilantro. Serve warm as a spring detoxifying soup.']",['Nepali'],https://images.unsplash.com/photo-1559058989-5d1e5e7f0bce?w=800&q=80,"['3 cups fresh stinging nettle leaves (sisnu, use gloves to handle)', '2 tablespoons mustard oil', '1 teaspoon fenugreek seeds', '2 dried red chilies', '1 teaspoon turmeric powder', '1 tablespoon ginger paste', '1 teaspoon salt', '4 cups water', '2 tablespoons fresh cilantro']",15 minutes,Sisnu Ko Jhol (Nettle Soup - Spring Special),3 servings,"Vegetarian, Soup"
,"['Heat oil, add cumin seeds, fenugreek seeds, and dried chilies. Add onion; sauté until light brown. Add turmeric, chili powder, and ivy gourd; stir well. Add salt and cook covered on low heat for 8–10 minutes until ivy gourd is tender, stirring occasionally. Add amchur, mix well. Serve as a dry side dish with rice or roti.']",['Nepali'],https://images.unsplash.com/photo-1571167541620-70f394f0d8e0?w=800&q=80,"['300g ivy gourd (phaplinda, washed and sliced lengthwise)', '2 tablespoons mustard oil', '1 teaspoon cumin seeds', '1/2 teaspoon fenugreek seeds', '2 dried red chilies', '1 small onion (sliced)', '1/2 teaspoon turmeric powder', '1 teaspoon red chili powder', '1/2 teaspoon salt', '1/2 teaspoon dry mango powder (amchur)']",10 minutes,Phaplinda Ko Tarkari (Nepali Ivy Gourd Stir-fry - Summer Vegetable),3 servings,"Vegetarian, Main Course"
,"['Heat ghee in a pot, add pounded rice and roast for 2 minutes until fragrant. Add water, milk, salt, and sugar/jaggery. Bring to boil, then reduce heat and simmer for 15–20 minutes, stirring occasionally, until rice is soft and porridge thickens. Add raisins, cashews, and cardamom powder. Cook 2 more minutes. Serve warm as a winter breakfast.']",['Nepali'],https://images.unsplash.com/photo-1555939594-77e04cd3ad8e?w=800&q=80,"['1 cup broken rice (mansuli chiura or pounded rice)', '4 cups milk', '2 cups water', '1/2 cup sugar (or jaggery)', '1/4 teaspoon salt', '2 tablespoons ghee', '2 tablespoons raisins', '2 tablespoons chopped cashews', '1/2 teaspoon cardamom powder']",20 minutes,Mansuli Ko Dhido (Pounded Rice Porridge - Winter Breakfast),4 servings,"Vegetarian, Main Course"
,"['In a bowl, combine green peas, onion, tomato, green chilies, and crushed peanuts. Add mustard oil, salt, chaat masala, black salt, lemon juice, and cilantro. Mix well. Serve immediately as a fresh spring snack.']",['Nepali'],https://images.unsplash.com/photo-1600891964599-f61ba0e24092?w=800&q=80,"['2 cups fresh green peas (parboiled for 2 minutes)', '1 small onion (finely chopped)', '1 tomato (finely chopped)', '2 green chilies (chopped)', '2 tablespoons roasted peanuts (crushed)', '1 tablespoon mustard oil', '1/2 teaspoon salt', '1/2 teaspoon chaat masala', '1/4 teaspoon black salt', '1 tablespoon lemon juice', '2 tablespoons fresh cilantro']",10 minutes,Kerau Ko Sadeko (Green Pea Spicy Salad - Spring Snack),3 servings,"Vegetarian, Snack"
,"['Grind hemp seeds coarsely. In a bowl, mix hemp seeds, gram flour, onion, green chilies, ginger paste, turmeric, chili powder, cumin powder, and salt. Add water gradually to make a thick batter. Heat oil. Drop spoonfuls into oil. Fry until golden and crispy (3–4 minutes). Drain. Serve during Holi festival with mint chutney.']",['Nepali'],https://images.unsplash.com/photo-1565299624946-b28f40a0ca4b?w=800&q=80,"['1/2 cup hemp seeds (bhang ko beu)', '1 cup gram flour (besan)', '1 small onion (finely chopped)', '2 green chilies (chopped)', '1 teaspoon ginger paste', '1/2 teaspoon turmeric powder', '1 teaspoon red chili powder', '1 teaspoon cumin powder', '1/2 teaspoon salt', 'Water as needed', 'Oil for deep frying']",15 minutes,Bhang Ko Pakoda (Hemp Seed Fritters - Holi Special),4 servings,"Vegetarian, Snack"
,"['Boil mushrooms in water for 5 minutes. Drain and dry completely in sun for 2–3 hours. Heat mustard oil until smoking, then cool slightly. In a glass jar, layer mushrooms, garlic cloves, fenugreek seeds, turmeric, chili powder, timur, and salt. Pour warm oil and lemon juice over. Close jar, shake well. Keep in sunlight for 3 days, shaking daily. Serve after 3 days as a monsoon specialty.']",['Nepali'],https://images.unsplash.com/photo-1571167452520-0e1a4e6cb2d5?w=800&q=80,"['200g wild mushrooms (anadi, cleaned and chopped)', '1/4 cup mustard oil', '1 tablespoon fenugreek seeds', '2 tablespoons turmeric powder', '2 tablespoons red chili powder', '1 tablespoon timur powder', '1 tablespoon salt', '2 tablespoons lemon juice', '1 head garlic (cloves separated and peeled)']",20 minutes (plus 3 days fermentation),Anadi Ko Achar (Wild Mushroom Pickle - Monsoon Forage),8 servings,"Vegetarian, Main Course"
,"['In a pan, cook lapsi with water until soft (10 minutes). Mash into pulp. In another pan, make sugar syrup with 1/4 cup water until one-string consistency. Add lapsi pulp and cardamom powder to syrup. Cook on low heat, stirring constantly, until mixture thickens and leaves the sides of the pan. Add ghee, mix. Spread on greased tray. Let cool and set for 4 hours. Cut into small pieces. Dry in sun for 1 day. Store in airtight container.']",['Nepali'],https://images.unsplash.com/photo-1565557623262-b51206e893e7?w=800&q=80,"['2 cups lapsi (hog plum, peeled and deseeded, chopped)', '1 cup sugar', '1/4 cup water', '1/2 teaspoon cardamom powder', '1 tablespoon ghee']",15 minutes (plus 1 day drying),Lapsi Ko Mithai (Hog Plum Candy - Winter Sweet),10 servings,"Vegetarian, Dessert"
,"['Heat oil, add fenugreek seeds and dried chilies. Add onion; sauté until golden. Add ginger-garlic paste, turmeric, chili powder; cook 1 minute. Add tomato and kinema; cook for 3 minutes. Add water and salt. Bring to boil, then simmer for 10 minutes. Add timur powder and cilantro. Serve warm with rice.']",['Nepali'],https://images.unsplash.com/photo-1585937421612-70a008356fbe?w=800&q=80,"['1 cup kinema (fermented soybeans, rinsed)', '2 tablespoons mustard oil', '1 teaspoon fenugreek seeds', '2 dried red chilies', '1 onion (finely chopped)', '1 tablespoon ginger-garlic paste', '1/2 teaspoon turmeric powder', '1 teaspoon red chili powder', '1 tomato (chopped)', '1 teaspoon salt', '3 cups water', '2 tablespoons fresh cilantro', '1/2 teaspoon timur powder']",15 minutes,Kinema Ko Jhol (Fermented Soybean Soup - Limbu Community Special),4 servings,"Vegetarian, Soup"
,"['Squeeze excess water from grated snake gourd. Heat mustard oil until smoking, then cool. In a bowl, combine snake gourd, fenugreek seeds, cumin seeds, asafoetida, turmeric, red chili powder, salt, green chilies, and lemon juice. Pour cooled oil over. Mix well. Let sit for 2 hours before serving. Refrigerate for up to 1 week.']",['Nepali'],https://images.unsplash.com/photo-1567620905732-2d1ec7ab7445?w=800&q=80,"['2 cups snake gourd (chichindo, peeled, deseeded, and grated)', '2 tablespoons mustard oil', '1 teaspoon fenugreek seeds', '1 teaspoon cumin seeds', '1/2 teaspoon asafoetida (hing)', '1 teaspoon turmeric powder', '2 teaspoons red chili powder', '1 tablespoon salt', '2 tablespoons lemon juice', '2 green chilies (slit)']",15 minutes,Chichindo Ko Achar (Snake Gourd Pickle - Summer Condiment),6 servings,"Vegetarian, Main Course"
,"['Wash taro stems thoroughly (they may cause itching if not properly cooked). Heat oil, add fenugreek seeds and dried chilies. Add taro stems and turmeric; stir-fry for 5 minutes. Add 1/2 cup water, cover, and cook for 10 minutes until stems are soft. Add chili powder, salt, and amchur. Cook uncovered for 2–3 minutes until dry. Serve as a side dish.']",['Nepali'],https://images.unsplash.com/photo-1512058564366-18510be2db19?w=800&q=80,"['2 cups taro stems (pidhalu, peeled and cut into 2-inch pieces)', '2 tablespoons mustard oil', '1 teaspoon fenugreek seeds', '2 dried red chilies', '1/2 teaspoon turmeric powder', '1 teaspoon red chili powder', '1/2 teaspoon salt', '1 teaspoon dry mango powder (amchur)']",15 minutes,Pidhalu Ko Bhuja (Taro Stem Stir-fry - Monsoon Vegetable),3 servings,"Vegetarian, Main Course"
,"['Heat ghee in a pot, add soaked and drained millet. Roast for 2 minutes. Add milk and bring to boil. Reduce heat and simmer for 20–25 minutes, stirring occasionally, until millet is soft and pudding thickens. Add sugar, raisins, almonds, and cardamom powder. Cook for 5 more minutes. Garnish with pistachios. Serve warm or cold.']",['Nepali'],https://images.unsplash.com/photo-1574484284002-952d92456975?w=800&q=80,"['1/2 cup foxtail millet (kaguno, rinsed and soaked for 1 hour)', '4 cups milk', '1/2 cup sugar', '2 tablespoons ghee', '2 tablespoons raisins', '2 tablespoons chopped almonds', '1/2 teaspoon cardamom powder', '1 tablespoon chopped pistachios for garnish']",20 minutes,Kaguno Ko Kheer (Foxtail Millet Pudding - Winter Dessert),4 servings,"Non-Vegetarian, Dessert"
,"['Blend bayar fruits, yogurt, water, sugar, cumin powder, and salt until smooth. Add ice cubes and blend again. Pour into glasses. Garnish with mint leaves. Serve cold as a summer afternoon refreshment.']",['Nepali'],https://images.unsplash.com/photo-1547592180-85f173990554?w=800&q=80,"['1 cup fresh bayar (jujube fruit, deseeded)', '2 cups plain yogurt (dahi)', '1/2 cup cold water', '4 tablespoons sugar (or honey)', '1/2 teaspoon roasted cumin powder', '1/4 teaspoon salt', 'Ice cubes as needed', 'Mint leaves for garnish']",10 minutes,Bayar Ko Lassi (Jujube Yogurt Drink - Summer Fruit Special),3 servings,"Vegetarian, Main Course"
,"['Rinse snails thoroughly. Heat oil, add fenugreek and cumin seeds. Add onions; sauté until golden. Add ginger-garlic paste, turmeric, chili powder, coriander; cook 2 minutes. Add tomato puree; cook until oil separates. Add snails and salt; stir for 5 minutes. Add water, cover, and simmer for 20 minutes. Garnish with cilantro. Serve with rice.']",['Nepali'],https://images.unsplash.com/photo-1596797038530-2c107229654b?w=800&q=80,"['500g freshwater snails (ghonghi, cleaned and soaked in salt water for 2 hours)', '4 tablespoons mustard oil', '1 teaspoon fenugreek seeds', '1 teaspoon cumin seeds', '2 onions (finely chopped)', '2 tablespoons ginger-garlic paste', '1 teaspoon turmeric powder', '2 teaspoons red chili powder', '2 teaspoons coriander powder', '3 tomatoes (pureed)', '1 teaspoon salt', '2 cups water', '2 tablespoons fresh cilantro']",30 minutes (plus 2 hours soaking),Ghonghi (Freshwater Snails - Terai Monsoon Delicacy),3 servings,"Vegetarian, Main Course"
,"['Boil fern shoots in water for 5 minutes. Drain. Heat oil, add fenugreek seeds, then onion and green chilies; sauté until onion is soft. Add turmeric, chili powder, and boiled fern shoots; stir-fry for 5–7 minutes. Add salt and timur powder. Cook for 2 more minutes. Serve as a dry vegetable side dish.']",['Nepali'],https://images.unsplash.com/photo-1455619452474-d2be8b1ae538?w=800&q=80,"['2 cups wild fern shoots (kachilo, cleaned and chopped into 1-inch pieces)', '2 tablespoons mustard oil', '1 teaspoon fenugreek seeds', '1 onion (sliced)', '2 green chilies (slit)', '1/2 teaspoon turmeric powder', '1 teaspoon red chili powder', '1/2 teaspoon salt', '1/2 teaspoon timur powder']",15 minutes,Kachilo Ko Tarkari (Wild Edible Fern - Spring Special),3 servings,"Vegetarian, Main Course"
,"['In a bowl, mix rice flour, grated coconut, jaggery, and salt. Add water gradually to make a thick batter (like pancake batter). Pour batter onto banana leaf squares. Fold leaves to make parcels. Steam in a steamer for 15–20 minutes until firm. Serve warm as a festival snack in the Terai region.']",['Nepali'],https://images.unsplash.com/photo-1504674900247-0877df9cc836?w=800&q=80,"['2 cups rice flour (fine)', '1/2 cup grated coconut', '1/2 cup jaggery (grated)', '1/4 teaspoon salt', '1 cup water (or as needed)', 'Banana leaves (cut into squares, for wrapping)']",15 minutes (plus 1 hour soaking),Bhakka (Steamed Rice Cake - Maithili Festival Special),4 servings,"Vegetarian, Main Course"
,"['For base: boil water with salt. Gradually add millet flour while stirring continuously to make a stiff dhido. Remove from heat, knead into flat round base using wet hands. Heat a pan with ghee, cook the millet base on both sides until crisp (5 minutes each side). Spread pizza sauce, add vegetables, top with cheese, oregano, and chili flakes. Cover pan and cook on low heat until cheese melts (3–4 minutes). Serve hot.']",['Nepali'],https://images.unsplash.com/photo-1490645935967-10de6ba17061?w=800&q=80,,25 minutes,Dhindo Ko Pizza (Finger Millet Pizza - Modern Healthy Snack),3 servings,"Vegetarian, Snack"
,"['In a bowl, mix flour, sugar, cardamom powder, and melted ghee. Add warm water and milk gradually to make a soft dough. Knead for 5 minutes. Cover and rest for 1 hour. Roll dough into small balls or ropes. Heat oil. Deep fry until golden brown (3–4 minutes). Drain. Dust with powdered sugar. Serve during Losar (Tibetan New Year).']",['Nepali'],https://images.unsplash.com/photo-1540189549336-e6e99e49c67f?w=800&q=80,"['2 cups all-purpose flour', '1/2 cup sugar', '2 tablespoons ghee (melted)', '1/2 teaspoon cardamom powder', '1/4 cup warm water (or as needed for dough)', '1/4 cup milk', 'Oil for deep frying', 'Powdered sugar for dusting']",20 minutes (plus 1 hour resting),Chamre (Sweet Fried Bread - Sherpa Festive Snack),6 servings,"Vegetarian, Dessert, Snack"
,"['Lightly steam sprouted lentils for 5 minutes. Drain and cool completely. Heat mustard oil until smoking, cool. In a glass jar, layer sprouted lentils and garlic. Mix turmeric, chili powder, fenugreek powder, asafoetida, and salt. Sprinkle spice mix over lentils. Pour cooled oil and lemon juice. Close jar. Keep in sunlight for 2 days, shaking daily. Serve after 2 days as a winter pickle.']",['Nepali'],https://images.unsplash.com/photo-1476224203421-74177f9f4a76?w=800&q=80,"['1 cup whole black lentils (biriya, sprouted for 2 days)', '1/4 cup mustard oil', '2 tablespoons turmeric powder', '2 tablespoons red chili powder', '1 tablespoon fenugreek powder (roasted)', '1 teaspoon asafoetida (hing)', '2 tablespoons salt', '1/4 cup lemon juice', '1 head garlic (peeled)']",20 minutes (plus 2 days fermentation),Biriya Ko Achar (Black Lentil Sprout Pickle - Winter Ferment),8 servings,"Vegetarian, Main Course"
,"['If using dried corn, boil until soft (30 minutes). Drain. Blend half the corn into a coarse paste. Heat ghee, add whole corn kernels and corn paste; sauté for 2 minutes. Add milk and bring to boil. Reduce heat and simmer for 15–20 minutes until thick. Add sugar, raisins, cashews, cardamom, nutmeg, and saffron. Cook 5 more minutes. Serve warm.']",['Nepali'],https://images.unsplash.com/photo-1414235077428-338989a2e8c0?w=800&q=80,"['1 cup fresh corn kernels (or 1/2 cup dried corn, soaked overnight)', '4 cups milk', '1/2 cup sugar', '2 tablespoons ghee', '2 tablespoons raisins', '2 tablespoons chopped cashews', '1/2 teaspoon cardamom powder', '1/4 teaspoon nutmeg powder', '1/2 teaspoon saffron strands (optional)']",20 minutes,Makai Ko Kheer (Corn Pudding - Harvest Festival),4 servings,"Vegetarian, Dessert"
,"['Scoop out bael pulp. Boil sugar and water to make one-string syrup. Add bael pulp, cardamom powder, and saffron. Cook on low heat for 20 minutes, stirring frequently, until mixture thickens and becomes translucent. Add lemon juice, cook 2 more minutes. Cool and store in sterilized jar. Serve 1 tablespoon as a summer digestive.']",['Nepali'],https://images.unsplash.com/photo-1482049016688-2d3e1b311543?w=800&q=80,"['2 large bael fruit (wood apple, pulp extracted)', '2 cups sugar', '1 cup water', '1/2 teaspoon cardamom powder', '1 tablespoon lemon juice', '1/2 teaspoon saffron strands (optional)']",30 minutes (plus 1 day soaking),Bael Ko Murabba (Wood Apple Preserve - Summer Cooling Sweet),10 servings,"Vegetarian, Dessert"
,"['In a bowl, mix millet flour and salt. Add warm water gradually and knead into a soft, pliable dough (millet dough can be sticky). Divide into 8 balls. Place one ball between two greased plastic sheets and press into flat round with hands. Carefully peel top sheet. Transfer to hot tawa (griddle). Cook on both sides until brown spots appear. Brush with ghee. Serve hot with gundruk ko achar.']",['Nepali'],https://images.unsplash.com/photo-1473093295043-cdd812d0e601?w=800&q=80,"['2 cups finger millet flour (kodo ko pitho)', '1/2 teaspoon salt', 'Warm water as needed (about 1 cup)', 'Ghee for brushing']",15 minutes,Kodo Ko Roti (Finger Millet Flatbread - Hill Station Snack),4 servings,"Vegetarian, Snack"
,"['In a bowl, mix buckwheat flour, salt, and melted ghee. Add warm water gradually and knead into smooth dough. Rest for 10 minutes. Divide into 8 balls. Roll each ball into flat round (buckwheat cracks easily, so handle gently). Cook on hot tawa for 1 minute per side, then cook directly on flame (or press with cloth) until puffed and charred. Brush with ghee. Serve with aloo ko achar.']",['Nepali'],https://images.unsplash.com/photo-1466637574441-749b8f19452f?w=800&q=80,"['2 cups buckwheat flour (phapar ko pitho)', '1/2 teaspoon salt', '2 tablespoons ghee (melted)', 'Warm water as needed (about 1 cup)', 'Extra ghee for cooking']",15 minutes,Phapar Ko Roti (Buckwheat Flatbread - Winter Snack),4 servings,"Vegetarian, Snack"
,"['In a bowl, mix rice flour, mashed banana, sugar, coconut, and cardamom powder. Add water gradually to make a thick, sticky dough. Pinch small portions and roll into smooth balls (no cracks). Heat oil. Deep fry on low-medium heat until golden brown (5–6 minutes). Drain. Serve as a sweet snack during festivals.']",['Nepali'],https://images.unsplash.com/photo-1512621776951-a57141f2eefd?w=800&q=80,"['2 cups rice flour', '1/2 cup mashed ripe banana', '1/2 cup sugar', '1/4 cup grated coconut', '1/2 teaspoon cardamom powder', 'Water as needed', 'Oil for deep frying']",15 minutes,Sel Phulaura (Sweet Rice Flour Dumplings - Festival Sweet),5 servings,"Vegetarian, Dessert"
