category,cooking_method,cuisine,image,ingredients,prep_time,recipe_name,serves,tags
,['Fry the red chillies and timur in oil until dark. Add the buffalo sukuti and turmeric. Sauté until the meat is well-browned and has absorbed the spices. This is a very popular accompaniment to local beverages.'],['Nepali'],https://images.unsplash.com/photo-1512621776951-a57141f2eefd?w=800&q=80,"['2 cups dried buffalo meat', '3 tablespoons mustard oil', '1 teaspoon Szechuan pepper (timur)', '2 dried red chillies', '1/2 teaspoon turmeric', '1/2 teaspoon salt']",20 minutes,Buff Sukuti,4 servings,"Non-Vegetarian, Main Course"
,"['Sauté the dried chicken strips in oil until golden. Add ginger and chilli powder, stirring well. Finish with salt and a squeeze of lemon juice to balance the savory flavors.']",['Nepali'],https://images.unsplash.com/photo-1498837167922-ddd27525d352?w=800&q=80,"['2 cups dried chicken strips', '2 tablespoons oil', '1 teaspoon ginger paste', '1/2 teaspoon red chilli powder', '1/2 teaspoon salt', '1 tablespoon lemon juice']",20 minutes,Chicken Sukuti,4 servings,"Non-Vegetarian, Main Course"
,['Heat a generous amount of oil in a pan. Deep fry or shallow fry the dried meat until it puffs up slightly and becomes very crispy. Drain excess oil and season with salt.'],['Nepali'],https://images.unsplash.com/photo-1567620832903-9fc6debc209f?w=800&q=80,"['2 cups assorted sukuti', '1/4 cup vegetable oil', '1/2 teaspoon salt']",10 minutes,Fried Sukuti,3 servings,"Non-Vegetarian, Main Course"
,"['In a large bowl, mix the fried sukuti with onions, roasted tomatoes, and chillies. Drizzle with raw mustard oil and lemon juice for an authentic pungent kick. Toss with cilantro and serve as a spicy salad-style appetizer.']",['Nepali'],https://images.unsplash.com/photo-1563379091054-1e4dddd2fbdc?w=800&q=80,"['2 cups fried sukuti', '1 small red onion (chopped)', '2 tomatoes (roasted and chopped)', '3 green chillies (finely sliced)', '1 tablespoon raw mustard oil', '1 tablespoon lemon juice', '1/4 cup fresh cilantro']",15 minutes,Sukuti Sadeko,4 servings,"Non-Vegetarian, Main Course"
,"['In a bowl, mix sukuti, gram flour, onion, green chilies, ginger-garlic paste, turmeric, chili powder,']",['Nepali'],https://images.unsplash.com/photo-1551248429-40975aa4de74?w=800&q=80,"['200g sukuti (dried buff/chicken meat, finely chopped or pounded)', '1 cup gram flour (besan)', '1 small onion (finely chopped)', '2 green chilies (finely chopped)', '1 teaspoon ginger-garlic paste', '1/2 teaspoon turmeric powder', '1 teaspoon red chili powder', '1 teaspoon cumin powder', '1 teaspoon coriander powder', '1/2 teaspoon salt (or to taste)', 'Water as needed', 'Oil for deep frying']",20 minutes,Sukuti Chop (Dried Meat Fritters),4 servings,"Non-Vegetarian, Snack"
,"['In a bowl, combine gram flour, all vegetables, green chilies, ginger-garlic paste, turmeric, chili powder, coriander powder, ajwain, and salt. Add water gradually to make a thick batter coating the vegetables. Heat oil. Drop small clusters of vegetable batter into oil. Fry until golden and crispy (4–5 minutes). Drain on paper towel. Serve with green chutney or tomato achar.']",['Nepali'],https://images.unsplash.com/photo-1603105037880-880cd4edfb0d?w=800&q=80,"['1 cup gram flour (besan)', '1 small onion (thinly sliced)', '1 small potato (thinly sliced)', '1/4 cup spinach leaves (chopped)', '1/4 cup cauliflower florets (small)', '2 green chilies (chopped)', '1 teaspoon ginger-garlic paste', '1/2 teaspoon turmeric powder', '1 teaspoon red chili powder', '1 teaspoon coriander powder', '1/2 teaspoon ajwain (carom seeds)', '1/2 teaspoon salt', 'Water as needed', 'Oil for deep frying']",15 minutes,Pakoda (Vegetable Fritters),4 servings,"Vegetarian, Snack"
,"['Separate onion slices. In a bowl, add gram flour, rice flour, green chilies, ginger paste, turmeric, chili powder, cumin, ajwain, and salt. Add water gradually to make a thick batter. Add onions and mix until well coated. Heat oil. Drop small batches of onion batter into oil. Fry until deep golden and crispy (3–4 minutes). Drain. Serve hot with mint chutney.']",['Nepali'],https://images.unsplash.com/photo-1542010589005-d1eaab3cbf88?w=800&q=80,"['2 large onions (thinly sliced)', '1 cup gram flour (besan)', '2 tablespoons rice flour (for crispiness)', '2 green chilies (chopped)', '1 teaspoon ginger paste', '1/2 teaspoon turmeric powder', '1 teaspoon red chili powder', '1 teaspoon cumin powder', '1/2 teaspoon ajwain (carom seeds)', '1/2 teaspoon salt', 'Water as needed', 'Oil for deep frying']",10 minutes,Pyaj Ko Pakoda (Onion Fritters),4 servings,"Vegetarian, Snack"
,"['In a bowl, mix gram flour, corn flour, ginger-garlic paste, turmeric, chili powder, garam masala, and salt. Add water to make a thick batter. Dip each spinach leaf into the batter, coating both sides. Heat oil. Gently drop battered spinach leaves into oil. Fry until crispy and golden (2–3 minutes per batch). Drain on paper towel. Serve immediately.']",['Nepali'],https://images.unsplash.com/photo-1548940740-a09f9a3d09ce?w=800&q=80,"['2 cups fresh spinach leaves (washed and dried)', '3/4 cup gram flour (besan)', '2 tablespoons corn flour', '1 teaspoon ginger-garlic paste', '1/2 teaspoon turmeric powder', '1 teaspoon red chili powder', '1/2 teaspoon garam masala', '1/2 teaspoon salt', 'Water as needed', 'Oil for deep frying']",10 minutes,Palak Pakoda (Spinach Fritters),3 servings,"Vegetarian, Snack"
,"['Drain soaked moong dal completely. Coarsely grind dal without water (use little water if needed, but batter should be thick). Add onion, green chilies, ginger, cilantro, turmeric, chili powder, cumin seeds, asafoetida, and salt. Mix well. Heat oil. Drop spoonfuls of batter into oil. Fry until golden brown and crispy (3–4 minutes). Drain. Serve with tamarind chutney.']",['Nepali'],https://images.unsplash.com/photo-1559058989-5d1e5e7f0bce?w=800&q=80,"['1 cup yellow moong dal (soaked for 3 hours)', '1 small onion (finely chopped)', '2 green chilies (chopped)', '1 tablespoon ginger (grated)', '1/4 cup fresh cilantro (chopped)', '1/2 teaspoon turmeric powder', '1 teaspoon red chili powder', '1 teaspoon cumin seeds', '1/2 teaspoon asafoetida (hing)', '1 teaspoon salt', 'Oil for deep frying']",20 minutes (plus 3 hours soaking),Moong Dal Pakoda (Moong Lentil Fritters),4 servings,"Vegetarian, Snack"
,"['In a bowl, mix gram flour, rice flour, ginger-garlic paste, turmeric, chili powder, garam masala, chaat masala, and salt. Add water to make a thick, coating batter. Dip paneer cubes into batter, ensuring even coating. Heat oil. Fry coated paneer cubes in batches until golden and crispy (2–3 minutes). Drain. Sprinkle extra chaat masala. Serve hot with green chutney.']",['Nepali'],https://images.unsplash.com/photo-1571167541620-70f394f0d8e0?w=800&q=80,"['250g paneer (cut into 1-inch cubes)', '3/4 cup gram flour (besan)', '2 tablespoons rice flour', '1 teaspoon ginger-garlic paste', '1/2 teaspoon turmeric powder', '1 teaspoon red chili powder', '1/2 teaspoon garam masala', '1/2 teaspoon chaat masala', '1/2 teaspoon salt', 'Water as needed', 'Oil for deep frying']",10 minutes,Paneer Pakoda (Paneer Fritters),4 servings,"Vegetarian, Snack"
,"['Mix gram flour, rice flour, ginger paste, turmeric, chili powder, garam masala, and salt. Add water to make a thick batter. For filling (optional): mix mashed potatoes, chaat masala, salt, green chilies, and cilantro. Spread filling on one bread slice, cover with another slice. Cut diagonally. Dip bread sandwiches into batter, coating well. Heat oil. Fry until golden and crispy (2–3 minutes per side). Drain. Serve with tomato ketchup or green chutney.']",['Nepali'],https://images.unsplash.com/photo-1555939594-77e04cd3ad8e?w=800&q=80,"['8 slices of white or brown bread', '1 cup gram flour (besan)', '2 tablespoons rice flour', '1 teaspoon ginger paste', '1/2 teaspoon turmeric powder', '1 teaspoon red chili powder', '1/2 teaspoon garam masala', '1/2 teaspoon salt', 'Water as needed', 'Oil for deep frying']",15 minutes,Bread Pakoda (Bread Fritters),4 servings,"Vegetarian, Snack"
,"['In a bowl, mix gram flour, rice flour, ginger-garlic paste, turmeric, chili powder, cumin powder, and salt. Add water to make a thick batter. Dip potato rounds into batter, coating both sides. Heat oil. Fry battered potato slices in batches until golden and crispy (3–4 minutes). Drain. Sprinkle chaat masala. Serve hot.']",['Nepali'],https://images.unsplash.com/photo-1600891964599-f61ba0e24092?w=800&q=80,"['2 large potatoes (cut into 1/4-inch rounds)', '1 cup gram flour (besan)', '2 tablespoons rice flour', '1 teaspoon ginger-garlic paste', '1/2 teaspoon turmeric powder', '1 teaspoon red chili powder', '1 teaspoon cumin powder', '1/2 teaspoon chaat masala', '1/2 teaspoon salt', 'Water as needed', 'Oil for deep frying']",15 minutes,Aalu Pakoda (Potato Fritters),4 servings,"Vegetarian, Snack"
,"['Puri:\xa0Mix flour, salt, and 1 tbsp oil. Add water gradually and knead into stiff dough. Rest 15 minutes. Roll into small circles. Heat oil for frying. Fry each puri until puffed and golden (30 seconds per side). Drain.\nTarkari:\xa0Heat oil, add cumin seeds, then onion; sauté until golden. Add ginger paste, turmeric, chili powder, coriander; cook 1 minute. Add tomato puree and salt; cook until oil separates. Add potatoes and water; simmer 5 minutes. Garnish with cilantro. Serve puri with hot tarkari.']",['Nepali'],https://images.unsplash.com/photo-1565299624946-b28f40a0ca4b?w=800&q=80,,30 minutes,Puri Tarkari (Fried Bread with Potato Curry),4 servings,"Vegetarian, Main Course"
,"['Make puri as in #149. For aloo chana: heat oil, add cumin seeds and onion; sauté until golden. Add ginger-garlic paste, turmeric, chili powder, coriander, cumin; cook 2 minutes. Add tomato puree and salt; cook until oil separates. Add potatoes, chickpeas, and water. Simmer 10 minutes. Add garam masala and cilantro. Serve puri with aloo chana.']",['Nepali'],https://images.unsplash.com/photo-1571167452520-0e1a4e6cb2d5?w=800&q=80,,30 minutes,Puri with Aloo Chana,4 servings,"Vegetarian, Main Course"
,"['In a bowl, mix gram flour, rice flour, ginger-garlic paste, turmeric, chili powder, cumin powder, and salt. Add water to make a thick batter. Dip eggplant rounds into batter, coating both sides. Heat oil. Fry battered eggplant in batches until golden and crispy (3–4 minutes). Drain. Sprinkle chaat masala. Serve hot.']",['Nepali'],https://images.unsplash.com/photo-1565557623262-b51206e893e7?w=800&q=80,"['1 large eggplant (cut into 1/4-inch rounds)', '1 cup gram flour (besan)', '2 tablespoons rice flour', '1 teaspoon ginger-garlic paste', '1/2 teaspoon turmeric powder', '1 teaspoon red chili powder', '1 teaspoon cumin powder', '1/2 teaspoon chaat masala', '1/2 teaspoon salt', 'Water as needed', 'Oil for deep frying']",15 minutes,Bhanta Chop (Eggplant Fritters),4 servings,"Egg, Snack"
,"['Blanch cauliflower florets in hot water for 2 minutes. Drain and pat dry. In a bowl, mix gram flour, corn flour, ginger-garlic paste, turmeric, chili powder, garam masala, ajwain, and salt. Add water to make thick batter. Dip each floret into batter. Heat oil. Fry until golden and crispy (3–4 minutes). Drain. Serve with mint chutney.']",['Nepali'],https://images.unsplash.com/photo-1585937421612-70a008356fbe?w=800&q=80,"['1 medium cauliflower (cut into medium florets)', '1 cup gram flour (besan)', '2 tablespoons corn flour', '1 teaspoon ginger-garlic paste', '1/2 teaspoon turmeric powder', '1 teaspoon red chili powder', '1 teaspoon garam masala', '1/2 teaspoon ajwain (carom seeds)', '1/2 teaspoon salt', 'Water as needed', 'Oil for deep frying']",15 minutes,Gobi Pakoda (Cauliflower Fritters),4 servings,"Vegetarian, Snack"
,"['Marinate chicken with corn flour, all-purpose flour, egg, salt, and pepper for 30 minutes. Deep fry until crispy and golden (5–6 minutes). Drain. In a wok, heat 3 tbsp oil, add garlic, ginger, green chilies; sauté 1 minute. Add onion and capsicum; stir-fry on high for 2 minutes. Add soy sauce, chili sauce, ketchup, sugar; mix. Add fried chicken; toss well for 2 minutes. Garnish with spring onions. Serve hot.']",['Nepali'],https://images.unsplash.com/photo-1567620905732-2d1ec7ab7445?w=800&q=80,"['500g boneless chicken (cubed)', '2 tablespoons corn flour', '2 tablespoons all-purpose flour', '1 egg', '1 teaspoon salt', '1 teaspoon black pepper powder', 'Oil for deep frying', '3 tablespoons oil (for stir fry)', '2 tablespoons garlic (chopped)', '2 tablespoons ginger (chopped)', '4 green chilies (slit)', '1 large onion (cubed)', '1 large capsicum (cubed)', '3 tablespoons soy sauce', '2 tablespoons red chili sauce', '1 tablespoon tomato ketchup', '1 teaspoon sugar', '2 tablespoons spring onions (chopped)']",25 minutes (plus 30 minutes marination),Chicken Chilli (Nepali Style Chilli Chicken),4 servings,"Non-Vegetarian, Main Course"
,"['Marinate pork with corn flour, all-purpose flour, egg, salt, pepper, and ginger-garlic paste for 30 minutes. Deep fry until crispy and fully cooked (6–8 minutes). Drain. In a wok, heat 3 tbsp oil, add garlic, ginger, green chilies; sauté 1 minute. Add onion and capsicum; stir-fry on high for 2 minutes. Add soy sauce, chili sauce, ketchup, sugar; mix. Add fried pork; toss well. Garnish with spring onions. Serve hot.']",['Nepali'],https://images.unsplash.com/photo-1512058564366-18510be2db19?w=800&q=80,"['500g boneless pork (cubed small)', '2 tablespoons corn flour', '2 tablespoons all-purpose flour', '1 egg', '1 teaspoon salt', '1 teaspoon black pepper powder', '1 teaspoon ginger-garlic paste', 'Oil for deep frying', '3 tablespoons oil (for stir fry)', '2 tablespoons garlic (chopped)', '2 tablespoons ginger (chopped)', '4 green chilies (slit)', '1 large onion (cubed)', '1 large capsicum (cubed)', '3 tablespoons soy sauce', '2 tablespoons red chili sauce', '1 tablespoon tomato ketchup', '1 teaspoon sugar', '2 tablespoons spring onions (chopped)']",30 minutes (plus 30 minutes marination),Pork Chilli (Nepali Style Chilli Pork),4 servings,"Non-Vegetarian, Main Course"
,"['Coat mushrooms with corn flour, all-purpose flour, salt, pepper, and ginger-garlic paste. Deep fry until crispy (3–4 minutes). Drain. In a wok, heat 2 tbsp oil, add garlic, ginger, green chilies; sauté 1 minute. Add onion and capsicum; stir-fry 2 minutes. Add soy sauce, chili sauce, ketchup, sugar; mix. Add fried mushrooms; toss gently for 2 minutes. Garnish with spring onions. Serve hot.']",['Nepali'],https://images.unsplash.com/photo-1574484284002-952d92456975?w=800&q=80,"['400g button mushrooms (quartered)', '3 tablespoons corn flour', '2 tablespoons all-purpose flour', '1 teaspoon salt', '1 teaspoon black pepper powder', '1 teaspoon ginger-garlic paste', 'Oil for deep frying', '2 tablespoons oil (for stir fry)', '1 tablespoon garlic (chopped)', '1 tablespoon ginger (chopped)', '3 green chilies (slit)', '1 onion (cubed)', '1 capsicum (cubed)', '2 tablespoons soy sauce', '2 tablespoons red chili sauce', '1 tablespoon tomato ketchup', '1/2 teaspoon sugar', '2 tablespoons spring onions']",20 minutes,Mushroom Chilli (Nepali Style Chilli Mushroom),3 servings,"Vegetarian, Main Course"
,"['In a bowl, mix oil, ginger-garlic paste, turmeric, chili powder, cumin, coriander, garam masala, fenugreek powder, and salt. Add chicken cubes, coat well. Marinate in refrigerator for 4–6 hours (preferably overnight). Thread chicken onto skewers. Grill on charcoal grill (preferred) or in oven at 200°C (400°F) for 10–12 minutes, turning occasionally, until charred and cooked through. Serve hot with green chutney and timur (Szechuan pepper) powder.']",['Nepali'],https://images.unsplash.com/photo-1547592180-85f173990554?w=800&q=80,"['600g boneless chicken (cut into 1-inch cubes)', '4 tablespoons mustard oil', '4 tablespoons ginger-garlic paste', '2 tablespoons turmeric powder', '2 tablespoons red chili powder', '2 tablespoons cumin powder', '2 tablespoons coriander powder', '1 tablespoon garam masala', '1 tablespoon fenugreek powder (optional)', '2 teaspoons salt', 'Wooden or metal skewers']",30 minutes (plus 4–6 hours marination),Chicken Sekuwa (Grilled Chicken Skewers),4 servings,"Non-Vegetarian, Main Course"
,"['Mix all spices, oil, and ginger-garlic paste. Add buffalo cubes, coat well. Marinate 6–8 hours (or overnight). Thread onto skewers. Grill on charcoal until charred outside and tender inside (15–20 minutes, turning frequently). Buffalo is tougher than chicken, so cook until no longer pink. Serve with roasted timur powder and tomato achar.']",['Nepali'],https://images.unsplash.com/photo-1596797038530-2c107229654b?w=800&q=80,"['600g buffalo meat (cut into 1-inch cubes)', '5 tablespoons mustard oil', '4 tablespoons ginger-garlic paste', '2 tablespoons turmeric powder', '2 tablespoons red chili powder', '2 tablespoons cumin powder', '2 tablespoons coriander powder', '1 tablespoon garam masala', '1 tablespoon fenugreek powder', '1 tablespoon timur (Szechuan pepper) powder', '2 teaspoons salt', 'Wooden or metal skewers']",30 minutes (plus 6–8 hours marination),Buff Sekuwa (Grilled Buffalo Skewers),4 servings,"Non-Vegetarian, Main Course"
,"['Mix oil, spices, and ginger-garlic paste. Add pork cubes, coat well. Marinate 4–6 hours. Thread pork onto skewers. Grill on charcoal or pan-grill over medium heat for 12–15 minutes, turning often, until pork is caramelized and fully cooked. Serve with green chutney, onion slices, and timur powder.']",['Nepali'],https://images.unsplash.com/photo-1455619452474-d2be8b1ae538?w=800&q=80,"['600g pork shoulder (cut into 1-inch cubes)', '4 tablespoons mustard oil', '4 tablespoons ginger-garlic paste', '2 tablespoons turmeric powder', '2 tablespoons red chili powder', '2 tablespoon cumin powder', '2 tablespoon coriander powder', '1 tablespoon garam masala', '1 tablespoon timur powder', '2 teaspoons salt', 'Wooden or metal skewers']",25 minutes (plus 4–6 hours marination),Pork Sekuwa (Grilled Pork Skewers),4 servings,"Non-Vegetarian, Main Course"
,"['Combine oil, all spices, and ginger-garlic paste. Marinate goat meat for 6–8 hours (longer for better tenderness). Thread onto skewers. Grill on charcoal for 15–20 minutes, turning frequently, until meat is charred on outside and fully cooked inside. Serve with spicy achar and beaten rice (chiura).']",['Nepali'],https://images.unsplash.com/photo-1504674900247-0877df9cc836?w=800&q=80,"['600g goat meat (bone-in or boneless, cut into chunks)', '5 tablespoons mustard oil', '4 tablespoons ginger-garlic paste', '2 tablespoons turmeric powder', '2 tablespoons red chili powder', '2 tablespoons cumin powder', '2 tablespoons coriander powder', '1 tablespoon garam masala', '1 tablespoon fenugreek powder', '1 tablespoon timur powder', '2 teaspoons salt', 'Wooden or metal skewers']",30 minutes (plus 6–8 hours marination),Mutton Sekuwa (Grilled Mutton/Goat Skewers),4 servings,"Non-Vegetarian, Main Course"
,"['In a bowl, mix oil, ginger-garlic paste, turmeric, chili powder, cumin, coriander, garam masala, timur, salt, and lemon juice. Add prawns, coat well. Marinate 30 minutes. Thread prawns onto skewers. Grill over high heat for 2–3 minutes per side until pink and slightly charred (do not overcook). Serve immediately with lemon wedges and green chutney.']",['Nepali'],https://images.unsplash.com/photo-1490645935967-10de6ba17061?w=800&q=80,"['500g large prawns (peeled, deveined, tails on)', '3 tablespoons mustard oil', '2 tablespoons ginger-garlic paste', '1 teaspoon turmeric powder', '1 teaspoon red chili powder', '1 teaspoon cumin powder', '1 teaspoon coriander powder', '1/2 teaspoon garam masala', '1/2 teaspoon timur powder', '1 teaspoon salt', '2 tablespoons lemon juice', 'Wooden or metal skewers']",15 minutes (plus 30 minutes marination),Prawn Sekuwa (Grilled Prawn Skewers),4 servings,"Non-Vegetarian, Main Course"
,"['Marinate cubed paneer in mustard oil, ginger-garlic paste, timur, cumin, turmeric, chili, garam masala, lemon juice, and salt for 20 minutes. Skewer and grill over charcoal or in a hot oven at 200°C for 10-12 minutes, turning occasionally until charred edges form. Garnish with cilantro and serve hot with chutney.']",['Nepali'],https://images.unsplash.com/photo-1540189549336-e6e99e49c67f?w=800&q=80,"['400g paneer (cubed)', '2 tablespoons mustard oil', '1 tablespoon ginger-garlic paste', '1 teaspoon timur powder (Sichuan pepper)', '1 teaspoon cumin powder', '1 teaspoon turmeric', '1 teaspoon chili powder', '1/2 teaspoon garam masala', 'juice of 1 lemon', 'salt to taste', 'chopped cilantro for garnish']",30 minutes (plus marination),Paneer Sekuwa (Grilled Paneer),4 servings,"Non-Vegetarian, Main Course"
,"['Beat eggs with salt, fry into thin omelets in mustard oil. Fill paratha with omelet, onions, tomato, chilies, chaat masala, and black salt. Roll tightly, optional grill briefly for crispiness. Slice and serve with tamarind chutney.']",['Nepali'],https://images.unsplash.com/photo-1476224203421-74177f9f4a76?w=800&q=80,"['4 parathas or rotis', '4 eggs (beaten)', '1 onion (sliced)', '1 tomato (chopped)', '2 green chilies (chopped)', '1 teaspoon chaat masala', '1/2 teaspoon black salt', '2 tablespoons mustard oil', 'salt to taste']",25 minutes,Egg Roll,4 servings,"Egg, Street Food"
,"['Stir-fry cabbage, carrot, sprouts, onions, and ginger in oil for 5 minutes, add soy and chili sauce, cool. Wrap filling in wrappers, seal with water, deep-fry in hot oil until golden and crisp, about 3-4 minutes per side. Drain and serve with dipping sauce.']",['Nepali'],https://images.unsplash.com/photo-1414235077428-338989a2e8c0?w=800&q=80,"['8 spring roll wrappers', '1 cup cabbage (shredded)', '1 carrot (julienned)', '1/2 cup bean sprouts', '2 green onions (chopped)', '1 teaspoon ginger (minced)', '1 tablespoon soy sauce', '1 teaspoon chili sauce', 'oil for frying']",40 minutes,Spring Roll,4 servings,"Vegetarian, Street Food"
,"['Mash boiled veggies with cumin, garam masala, salt, and cilantro. Sauté onions in mustard oil, mix in veggies. Spread yogurt on roti, add filling, roll up. Toast on tawa until warm and crisp outside.']",['Nepali'],https://images.unsplash.com/photo-1482049016688-2d3e1b311543?w=800&q=80,"['4 rotis or parathas', '1 cup mixed veggies (potato, carrot, peas - boiled)', '1 onion (sliced)', '1 teaspoon cumin powder', '1/2 teaspoon garam masala', '1 tablespoon mustard oil', 'chopped cilantro', 'salt to taste', 'yogurt for spreading']",30 minutes,Veg Roll,4 servings,"Vegetarian, Street Food"
,"['Boil noodles, drain. Heat oil, stir-fry garlic, ginger, onions, carrot, pepper, and cabbage for 5 minutes. Add soy sauce and noodles, toss on high heat for 3-5 minutes until coated and slightly crispy. Garnish with green onions.']",['Nepali'],https://images.unsplash.com/photo-1473093295043-cdd812d0e601?w=800&q=80,"['300g egg noodles (boiled)', '1 cup cabbage (shredded)', '1 carrot (sliced)', '1 bell pepper (sliced)', '1 onion (sliced)', '2 tablespoons soy sauce', '1 teaspoon garlic paste', '1 teaspoon ginger paste', '2 tablespoons oil', 'green onions for garnish']",25 minutes,Chowmein (Fried Noodles),4 servings,"Vegetarian, Street Food"
,"['Boil and drain noodles. Sauté garlic and ginger in sesame oil, add veggies, stir-fry until tender-crisp. Toss in sauces, noodles, salt, and pepper; wok-fry 4 minutes for flavor infusion.']",['Nepali'],https://images.unsplash.com/photo-1466637574441-749b8f19452f?w=800&q=80,"['300g chowmein noodles', '2 cups mixed veggies (broccoli, beans, carrot)', '1 teaspoon sesame oil', '2 tablespoons soy sauce', '1 teaspoon chili sauce', '2 garlic cloves (minced)', '1 inch ginger (grated)', 'salt and pepper to taste']",25 minutes,Veg Chowmein,4 servings,"Vegetarian, Street Food"
,"['Marinate chicken in ginger-garlic and soy. Boil noodles. Stir-fry chicken until cooked, add veggies, then noodles and sauces, high-heat toss for 5 minutes.']",['Nepali'],https://images.unsplash.com/photo-1512621776951-a57141f2eefd?w=800&q=80,"['300g noodles', '300g chicken (sliced)', '1 cup cabbage', '1 carrot', '1 onion', '2 tablespoons soy sauce', '1 teaspoon oyster sauce (optional)', 'ginger-garlic paste 1 tbsp', 'oil']",30 minutes,Chicken Chowmein,4 servings,"Non-Vegetarian, Street Food"
,"['Tenderize buffalo meat with timur and garlic in oil, cook 10 minutes. Add veggies, then boiled noodles and soy, stir-fry vigorously.']",['Nepali'],https://images.unsplash.com/photo-1498837167922-ddd27525d352?w=800&q=80,"['300g noodles', '300g buffalo meat (thin strips)', 'veggies: cabbage, carrot, onion (1 cup each)', '2 tbsp soy sauce', '1 tsp timur powder', 'mustard oil 2 tbsp', 'garlic 3 cloves']",35 minutes,Buff Chowmein (Buffalo Chowmein),4 servings,"Non-Vegetarian, Street Food"
,"['Simmer broth with tomato puree, spices, and veggies 20 minutes. Boil noodles separately, combine, garnish with cilantro and lemon.', ""Ingredients:\xa0('2 cups flour', '1 tsp carom seeds', 'oil, salt')\nCooking Method (Recipe):\xa0Knead spiced dough, cut diamonds, deep-fry crisp."", 'ogurt with spices and nuts.']",['Nepali'],https://images.unsplash.com/photo-1567620832903-9fc6debc209f?w=800&q=80,"['200g noodles', '4 cups veg broth', '1 cup mixed veggies', '1 tomato (pureed)', '1 tsp cumin', '1 tsp chili powder', 'cilantro, lemon']",40 minutes,Thukpa (Noodle Soup),4 servings,"Vegetarian, Soup"
